Time,Source,Destination,Protocol,Length,Info,Label
"[413.852895, 413.852898, 413.852954, 413.865351, 414.065956, 414.065963, 414.069919, 414.069921, 428.881211, 428.881224, 443.896526, 443.89654, 458.911837, 458.91185, 473.927147, 473.927162, -3805.024839, -3805.024827, -3790.009528, -3790.009513, -3774.994217, -3774.994204, -3759.978908, -3759.978893, -3744.963595, -3744.963582, -3729.948278, -3729.948263, -3714.932943, -3714.932931]","['10.128.0.1', '192.168.1.9', '10.128.0.1', '10.128.0.1', '10.128.0.1', '192.168.1.9', '10.128.0.1', '192.168.1.9', '10.128.0.1', '192.168.1.9', '10.128.0.1', '192.168.1.9', '10.128.0.1', '192.168.1.9', '10.128.0.1', '192.168.1.9', '10.128.0.1', '192.168.1.9', '10.128.0.1', '192.168.1.9', '10.128.0.1', '192.168.1.9', '10.128.0.1', '192.168.1.9', '10.128.0.1', '192.168.1.9', '10.128.0.1', '192.168.1.9', '10.128.0.1', '192.168.1.9']","['192.168.1.9', '10.128.0.1', '192.168.1.9', '192.168.1.9', '192.168.1.9', '10.128.0.1', '192.168.1.9', '10.128.0.1', '192.168.1.9', '10.128.0.1', '192.168.1.9', '10.128.0.1', '192.168.1.9', '10.128.0.1', '192.168.1.9', '10.128.0.1', '192.168.1.9', '10.128.0.1', '192.168.1.9', '10.128.0.1', '192.168.1.9', '10.128.0.1', '192.168.1.9', '10.128.0.1', '192.168.1.9', '10.128.0.1', '192.168.1.9', '10.128.0.1', '192.168.1.9', '10.128.0.1']","['TCP', 'TCP', 'TCP', 'TCP', 'TCP', 'TCP', 'TCP', 'TCP', 'TCP', 'TCP', 'TCP', 'TCP', 'TCP', 'TCP', 'TCP', 'TCP', 'TCP', 'TCP', 'TCP', 'TCP', 'TCP', 'TCP', 'TCP', 'TCP', 'TCP', 'TCP', 'TCP', 'TCP', 'TCP', 'TCP']","[74, 66, 54, 75, 232, 66, 75, 54, 63, 54, 65, 54, 65, 54, 65, 54, 65, 54, 65, 54, 65, 54, 65, 54, 65, 54, 65, 54, 64, 54]","['46680  >  80 [SYN] Seq=0 Win=29200 Len=0 MSS=1460 SACK_PERM TSval=1441947135 TSecr=0 WS=128', '80  >  46680 [SYN, ACK] Seq=0 Ack=1 Win=42340 Len=0 MSS=1460 SACK_PERM WS=8192', '46680  >  80 [ACK] Seq=1 Ack=1 Win=29312 Len=0', '46680  >  80 [PSH, ACK] Seq=1 Ack=1 Win=29312 Len=21 [TCP segment of a reassembled PDU]', '46680  >  80 [PSH, ACK] Seq=22 Ack=1 Win=29312 Len=178 [TCP segment of a reassembled PDU]', '[TCP Window Update] 80  >  46680 [ACK] Seq=1 Ack=1 Win=49152 Len=0 SLE=22 SRE=200', '[TCP Retransmission] 46680  >  80 [PSH, ACK] Seq=1 Ack=1 Win=29312 Len=21', '80  >  46680 [ACK] Seq=1 Ack=200 Win=49152 Len=0', '46680  >  80 [PSH, ACK] Seq=200 Ack=1 Win=29312 Len=9 [TCP segment of a reassembled PDU]', '80  >  46680 [ACK] Seq=1 Ack=209 Win=49152 Len=0', '46680  >  80 [PSH, ACK] Seq=209 Ack=1 Win=29312 Len=11 [TCP segment of a reassembled PDU]', '80  >  46680 [ACK] Seq=1 Ack=220 Win=49152 Len=0', '46680  >  80 [PSH, ACK] Seq=220 Ack=1 Win=29312 Len=11 [TCP segment of a reassembled PDU]', '80  >  46680 [ACK] Seq=1 Ack=231 Win=49152 Len=0', '46680  >  80 [PSH, ACK] Seq=231 Ack=1 Win=29312 Len=11 [TCP segment of a reassembled PDU]', '80  >  46680 [ACK] Seq=1 Ack=242 Win=49152 Len=0', '46680  >  80 [PSH, ACK] Seq=242 Ack=1 Win=29312 Len=11 [TCP segment of a reassembled PDU]', '80  >  46680 [ACK] Seq=1 Ack=253 Win=49152 Len=0', '46680  >  80 [PSH, ACK] Seq=253 Ack=1 Win=29312 Len=11 [TCP segment of a reassembled PDU]', '80  >  46680 [ACK] Seq=1 Ack=264 Win=49152 Len=0', '46680  >  80 [PSH, ACK] Seq=264 Ack=1 Win=29312 Len=11 [TCP segment of a reassembled PDU]', '80  >  46680 [ACK] Seq=1 Ack=275 Win=49152 Len=0', '46680  >  80 [PSH, ACK] Seq=275 Ack=1 Win=29312 Len=11 [TCP segment of a reassembled PDU]', '80  >  46680 [ACK] Seq=1 Ack=286 Win=49152 Len=0', '46680  >  80 [PSH, ACK] Seq=286 Ack=1 Win=29312 Len=11 [TCP segment of a reassembled PDU]', '80  >  46680 [ACK] Seq=1 Ack=297 Win=49152 Len=0', '46680  >  80 [PSH, ACK] Seq=297 Ack=1 Win=29312 Len=11 [TCP segment of a reassembled PDU]', '80  >  46680 [ACK] Seq=1 Ack=308 Win=49152 Len=0', '46680  >  80 [PSH, ACK] Seq=308 Ack=1 Win=29312 Len=10 [TCP segment of a reassembled PDU]', '80  >  46680 [ACK] Seq=1 Ack=318 Win=49152 Len=0']",1
"[413.708691, 413.708693, 413.70876, 413.713992, 413.713995, 413.714049, 413.714051, 413.71448, 413.714481, 428.729944, 428.729957, 443.745309, 443.745324, 458.760642, 458.760654, 473.775972, 473.775987, -3805.175997, -3805.175983, -3790.160664, -3790.160649, -3775.145334, -3775.145321, -3760.130006, -3760.129992, -3745.114674, -3745.114661, -3730.099345, -3730.099331, -3715.084015]","['10.128.0.2', '192.168.1.9', '10.128.0.2', '10.128.0.2', '192.168.1.9', '10.128.0.2', '192.168.1.9', '10.128.0.2', '192.168.1.9', '10.128.0.2', '192.168.1.9', '10.128.0.2', '192.168.1.9', '10.128.0.2', '192.168.1.9', '10.128.0.2', '192.168.1.9', '10.128.0.2', '192.168.1.9', '10.128.0.2', '192.168.1.9', '10.128.0.2', '192.168.1.9', '10.128.0.2', '192.168.1.9', '10.128.0.2', '192.168.1.9', '10.128.0.2', '192.168.1.9', '10.128.0.2']","['192.168.1.9', '10.128.0.2', '192.168.1.9', '192.168.1.9', '10.128.0.2', '192.168.1.9', '10.128.0.2', '192.168.1.9', '10.128.0.2', '192.168.1.9', '10.128.0.2', '192.168.1.9', '10.128.0.2', '192.168.1.9', '10.128.0.2', '192.168.1.9', '10.128.0.2', '192.168.1.9', '10.128.0.2', '192.168.1.9', '10.128.0.2', '192.168.1.9', '10.128.0.2', '192.168.1.9', '10.128.0.2', '192.168.1.9', '10.128.0.2', '192.168.1.9', '10.128.0.2', '192.168.1.9']","['TCP', 'TCP', 'TCP', 'TCP', 'TCP', 'TCP', 'TCP', 'TCP', 'TCP', 'TCP', 'TCP', 'TCP', 'TCP', 'TCP', 'TCP', 'TCP', 'TCP', 'TCP', 'TCP', 'TCP', 'TCP', 'TCP', 'TCP', 'TCP', 'TCP', 'TCP', 'TCP', 'TCP', 'TCP', 'TCP']","[74, 66, 54, 75, 54, 222, 54, 65, 54, 65, 54, 65, 54, 65, 54, 64, 54, 65, 54, 65, 54, 65, 54, 65, 54, 65, 54, 65, 54, 65]","['50397  >  80 [SYN] Seq=0 Win=29200 Len=0 MSS=1460 SACK_PERM TSval=1441947099 TSecr=0 WS=128', '80  >  50397 [SYN, ACK] Seq=0 Ack=1 Win=42340 Len=0 MSS=1460 SACK_PERM WS=8192', '50397  >  80 [ACK] Seq=1 Ack=1 Win=29312 Len=0', '50397  >  80 [PSH, ACK] Seq=1 Ack=1 Win=29312 Len=21 [TCP segment of a reassembled PDU]', '80  >  50397 [ACK] Seq=1 Ack=22 Win=49152 Len=0', '50397  >  80 [PSH, ACK] Seq=22 Ack=1 Win=29312 Len=168 [TCP segment of a reassembled PDU]', '80  >  50397 [ACK] Seq=1 Ack=190 Win=49152 Len=0', '50397  >  80 [PSH, ACK] Seq=190 Ack=1 Win=29312 Len=11 [TCP segment of a reassembled PDU]', '80  >  50397 [ACK] Seq=1 Ack=201 Win=49152 Len=0', '50397  >  80 [PSH, ACK] Seq=201 Ack=1 Win=29312 Len=11 [TCP segment of a reassembled PDU]', '80  >  50397 [ACK] Seq=1 Ack=212 Win=49152 Len=0', '50397  >  80 [PSH, ACK] Seq=212 Ack=1 Win=29312 Len=11 [TCP segment of a reassembled PDU]', '80  >  50397 [ACK] Seq=1 Ack=223 Win=49152 Len=0', '50397  >  80 [PSH, ACK] Seq=223 Ack=1 Win=29312 Len=11 [TCP segment of a reassembled PDU]', '80  >  50397 [ACK] Seq=1 Ack=234 Win=49152 Len=0', '50397  >  80 [PSH, ACK] Seq=234 Ack=1 Win=29312 Len=10 [TCP segment of a reassembled PDU]', '80  >  50397 [ACK] Seq=1 Ack=244 Win=49152 Len=0', '50397  >  80 [PSH, ACK] Seq=244 Ack=1 Win=29312 Len=11 [TCP segment of a reassembled PDU]', '80  >  50397 [ACK] Seq=1 Ack=255 Win=49152 Len=0', '50397  >  80 [PSH, ACK] Seq=255 Ack=1 Win=29312 Len=11 [TCP segment of a reassembled PDU]', '80  >  50397 [ACK] Seq=1 Ack=266 Win=49152 Len=0', '50397  >  80 [PSH, ACK] Seq=266 Ack=1 Win=29312 Len=11 [TCP segment of a reassembled PDU]', '80  >  50397 [ACK] Seq=1 Ack=277 Win=49152 Len=0', '50397  >  80 [PSH, ACK] Seq=277 Ack=1 Win=29312 Len=11 [TCP segment of a reassembled PDU]', '80  >  50397 [ACK] Seq=1 Ack=288 Win=49152 Len=0', '50397  >  80 [PSH, ACK] Seq=288 Ack=1 Win=29312 Len=11 [TCP segment of a reassembled PDU]', '80  >  50397 [ACK] Seq=1 Ack=299 Win=49152 Len=0', '50397  >  80 [PSH, ACK] Seq=299 Ack=1 Win=29312 Len=11 [TCP segment of a reassembled PDU]', '80  >  50397 [ACK] Seq=1 Ack=310 Win=49152 Len=0', '50397  >  80 [PSH, ACK] Seq=310 Ack=1 Win=29312 Len=11 [TCP segment of a reassembled PDU]']",1
"[413.821333, 413.821335, 413.82139, 413.821569, 413.821572, 413.821616, 413.821618, 413.821921, 413.821922, 428.837391, 428.837404, 443.852755, 443.85277, 458.868105, 458.868118, 473.870358, 473.870373, -3805.081596, -3805.081584, -3790.068894, -3790.068879, -3775.053562, -3775.053549, -3760.048893, -3760.04889, -3745.033539, -3745.033536, -3730.020791, -3730.020787, -3715.005454]","['10.128.0.3', '192.168.1.9', '10.128.0.3', '10.128.0.3', '192.168.1.9', '10.128.0.3', '192.168.1.9', '10.128.0.3', '192.168.1.9', '10.128.0.3', '192.168.1.9', '10.128.0.3', '192.168.1.9', '10.128.0.3', '192.168.1.9', '10.128.0.3', '192.168.1.9', '10.128.0.3', '192.168.1.9', '10.128.0.3', '192.168.1.9', '10.128.0.3', '192.168.1.9', '10.128.0.3', '192.168.1.9', '10.128.0.3', '192.168.1.9', '10.128.0.3', '192.168.1.9', '10.128.0.3']","['192.168.1.9', '10.128.0.3', '192.168.1.9', '192.168.1.9', '10.128.0.3', '192.168.1.9', '10.128.0.3', '192.168.1.9', '10.128.0.3', '192.168.1.9', '10.128.0.3', '192.168.1.9', '10.128.0.3', '192.168.1.9', '10.128.0.3', '192.168.1.9', '10.128.0.3', '192.168.1.9', '10.128.0.3', '192.168.1.9', '10.128.0.3', '192.168.1.9', '10.128.0.3', '192.168.1.9', '10.128.0.3', '192.168.1.9', '10.128.0.3', '192.168.1.9', '10.128.0.3', '192.168.1.9']","['TCP', 'TCP', 'TCP', 'TCP', 'TCP', 'TCP', 'TCP', 'TCP', 'TCP', 'TCP', 'TCP', 'TCP', 'TCP', 'TCP', 'TCP', 'TCP', 'TCP', 'TCP', 'TCP', 'TCP', 'TCP', 'TCP', 'TCP', 'TCP', 'TCP', 'TCP', 'TCP', 'TCP', 'TCP', 'TCP']","[74, 66, 54, 74, 54, 222, 54, 65, 54, 65, 54, 65, 54, 65, 54, 65, 54, 65, 54, 65, 54, 65, 54, 64, 54, 65, 54, 65, 54, 65]","['49705  >  80 [SYN] Seq=0 Win=29200 Len=0 MSS=1460 SACK_PERM TSval=1441947127 TSecr=0 WS=128', '80  >  49705 [SYN, ACK] Seq=0 Ack=1 Win=42340 Len=0 MSS=1460 SACK_PERM WS=8192', '49705  >  80 [ACK] Seq=1 Ack=1 Win=29312 Len=0', '49705  >  80 [PSH, ACK] Seq=1 Ack=1 Win=29312 Len=20 [TCP segment of a reassembled PDU]', '80  >  49705 [ACK] Seq=1 Ack=21 Win=49152 Len=0', '49705  >  80 [PSH, ACK] Seq=21 Ack=1 Win=29312 Len=168 [TCP segment of a reassembled PDU]', '80  >  49705 [ACK] Seq=1 Ack=189 Win=49152 Len=0', '49705  >  80 [PSH, ACK] Seq=189 Ack=1 Win=29312 Len=11 [TCP segment of a reassembled PDU]', '80  >  49705 [ACK] Seq=1 Ack=200 Win=49152 Len=0', '49705  >  80 [PSH, ACK] Seq=200 Ack=1 Win=29312 Len=11 [TCP segment of a reassembled PDU]', '80  >  49705 [ACK] Seq=1 Ack=211 Win=49152 Len=0', '49705  >  80 [PSH, ACK] Seq=211 Ack=1 Win=29312 Len=11 [TCP segment of a reassembled PDU]', '80  >  49705 [ACK] Seq=1 Ack=222 Win=49152 Len=0', '49705  >  80 [PSH, ACK] Seq=222 Ack=1 Win=29312 Len=11 [TCP segment of a reassembled PDU]', '80  >  49705 [ACK] Seq=1 Ack=233 Win=49152 Len=0', '49705  >  80 [PSH, ACK] Seq=233 Ack=1 Win=29312 Len=11 [TCP segment of a reassembled PDU]', '80  >  49705 [ACK] Seq=1 Ack=244 Win=49152 Len=0', '49705  >  80 [PSH, ACK] Seq=244 Ack=1 Win=29312 Len=11 [TCP segment of a reassembled PDU]', '80  >  49705 [ACK] Seq=1 Ack=255 Win=49152 Len=0', '49705  >  80 [PSH, ACK] Seq=255 Ack=1 Win=29312 Len=11 [TCP segment of a reassembled PDU]', '80  >  49705 [ACK] Seq=1 Ack=266 Win=49152 Len=0', '49705  >  80 [PSH, ACK] Seq=266 Ack=1 Win=29312 Len=11 [TCP segment of a reassembled PDU]', '80  >  49705 [ACK] Seq=1 Ack=277 Win=49152 Len=0', '49705  >  80 [PSH, ACK] Seq=277 Ack=1 Win=29312 Len=10 [TCP segment of a reassembled PDU]', '80  >  49705 [ACK] Seq=1 Ack=287 Win=49152 Len=0', '49705  >  80 [PSH, ACK] Seq=287 Ack=1 Win=29312 Len=11 [TCP segment of a reassembled PDU]', '80  >  49705 [ACK] Seq=1 Ack=298 Win=49152 Len=0', '49705  >  80 [PSH, ACK] Seq=298 Ack=1 Win=29312 Len=11 [TCP segment of a reassembled PDU]', '80  >  49705 [ACK] Seq=1 Ack=309 Win=49152 Len=0', '49705  >  80 [PSH, ACK] Seq=309 Ack=1 Win=29312 Len=11 [TCP segment of a reassembled PDU]']",1
"[413.703886, 413.703889, 413.703987, 413.710004, 413.710007, 413.710054, 413.710056, 413.710541, 413.710542, 428.726061, 428.726074, 443.741401, 443.741415, 458.756756, 458.756769, 473.772102, 473.772116, -3805.17986, -3805.179846, -3790.164549, -3790.164535, -3775.1492, -3775.149187, -3760.13382, -3760.133805, -3745.118469, -3745.118455, -3730.103114, -3730.1031, -3715.087764]","['10.128.0.4', '192.168.1.9', '10.128.0.4', '10.128.0.4', '192.168.1.9', '10.128.0.4', '192.168.1.9', '10.128.0.4', '192.168.1.9', '10.128.0.4', '192.168.1.9', '10.128.0.4', '192.168.1.9', '10.128.0.4', '192.168.1.9', '10.128.0.4', '192.168.1.9', '10.128.0.4', '192.168.1.9', '10.128.0.4', '192.168.1.9', '10.128.0.4', '192.168.1.9', '10.128.0.4', '192.168.1.9', '10.128.0.4', '192.168.1.9', '10.128.0.4', '192.168.1.9', '10.128.0.4']","['192.168.1.9', '10.128.0.4', '192.168.1.9', '192.168.1.9', '10.128.0.4', '192.168.1.9', '10.128.0.4', '192.168.1.9', '10.128.0.4', '192.168.1.9', '10.128.0.4', '192.168.1.9', '10.128.0.4', '192.168.1.9', '10.128.0.4', '192.168.1.9', '10.128.0.4', '192.168.1.9', '10.128.0.4', '192.168.1.9', '10.128.0.4', '192.168.1.9', '10.128.0.4', '192.168.1.9', '10.128.0.4', '192.168.1.9', '10.128.0.4', '192.168.1.9', '10.128.0.4', '192.168.1.9']","['TCP', 'TCP', 'TCP', 'TCP', 'TCP', 'TCP', 'TCP', 'TCP', 'TCP', 'TCP', 'TCP', 'TCP', 'TCP', 'TCP', 'TCP', 'TCP', 'TCP', 'TCP', 'TCP', 'TCP', 'TCP', 'TCP', 'TCP', 'TCP', 'TCP', 'TCP', 'TCP', 'TCP', 'TCP', 'TCP']","[74, 66, 54, 74, 54, 222, 54, 65, 54, 65, 54, 65, 54, 65, 54, 65, 54, 64, 54, 65, 54, 65, 54, 65, 54, 65, 54, 65, 54, 65]","['39804  >  80 [SYN] Seq=0 Win=29200 Len=0 MSS=1460 SACK_PERM TSval=1441947098 TSecr=0 WS=128', '80  >  39804 [SYN, ACK] Seq=0 Ack=1 Win=42340 Len=0 MSS=1460 SACK_PERM WS=8192', '39804  >  80 [ACK] Seq=1 Ack=1 Win=29312 Len=0', '39804  >  80 [PSH, ACK] Seq=1 Ack=1 Win=29312 Len=20 [TCP segment of a reassembled PDU]', '80  >  39804 [ACK] Seq=1 Ack=21 Win=49152 Len=0', '39804  >  80 [PSH, ACK] Seq=21 Ack=1 Win=29312 Len=168 [TCP segment of a reassembled PDU]', '80  >  39804 [ACK] Seq=1 Ack=189 Win=49152 Len=0', '39804  >  80 [PSH, ACK] Seq=189 Ack=1 Win=29312 Len=11 [TCP segment of a reassembled PDU]', '80  >  39804 [ACK] Seq=1 Ack=200 Win=49152 Len=0', '39804  >  80 [PSH, ACK] Seq=200 Ack=1 Win=29312 Len=11 [TCP segment of a reassembled PDU]', '80  >  39804 [ACK] Seq=1 Ack=211 Win=49152 Len=0', '39804  >  80 [PSH, ACK] Seq=211 Ack=1 Win=29312 Len=11 [TCP segment of a reassembled PDU]', '80  >  39804 [ACK] Seq=1 Ack=222 Win=49152 Len=0', '39804  >  80 [PSH, ACK] Seq=222 Ack=1 Win=29312 Len=11 [TCP segment of a reassembled PDU]', '80  >  39804 [ACK] Seq=1 Ack=233 Win=49152 Len=0', '39804  >  80 [PSH, ACK] Seq=233 Ack=1 Win=29312 Len=11 [TCP segment of a reassembled PDU]', '80  >  39804 [ACK] Seq=1 Ack=244 Win=49152 Len=0', '39804  >  80 [PSH, ACK] Seq=244 Ack=1 Win=29312 Len=10 [TCP segment of a reassembled PDU]', '80  >  39804 [ACK] Seq=1 Ack=254 Win=49152 Len=0', '39804  >  80 [PSH, ACK] Seq=254 Ack=1 Win=29312 Len=11 [TCP segment of a reassembled PDU]', '80  >  39804 [ACK] Seq=1 Ack=265 Win=49152 Len=0', '39804  >  80 [PSH, ACK] Seq=265 Ack=1 Win=29312 Len=11 [TCP segment of a reassembled PDU]', '80  >  39804 [ACK] Seq=1 Ack=276 Win=49152 Len=0', '39804  >  80 [PSH, ACK] Seq=276 Ack=1 Win=29312 Len=11 [TCP segment of a reassembled PDU]', '80  >  39804 [ACK] Seq=1 Ack=287 Win=49152 Len=0', '39804  >  80 [PSH, ACK] Seq=287 Ack=1 Win=29312 Len=11 [TCP segment of a reassembled PDU]', '80  >  39804 [ACK] Seq=1 Ack=298 Win=49152 Len=0', '39804  >  80 [PSH, ACK] Seq=298 Ack=1 Win=29312 Len=11 [TCP segment of a reassembled PDU]', '80  >  39804 [ACK] Seq=1 Ack=309 Win=49152 Len=0', '39804  >  80 [PSH, ACK] Seq=309 Ack=1 Win=29312 Len=11 [TCP segment of a reassembled PDU]']",1
"[413.709588, 413.709591, 413.709652, 413.710586, 413.710589, 413.710647, 413.71065, 413.711054, 413.711055, 428.726517, 428.72653, 443.741857, 443.741871, 458.757191, 458.757203, 473.772496, 473.77251, -3805.179478, -3805.179465, -3790.164149, -3790.164135, -3775.14882, -3775.148807, -3760.133505, -3760.133491, -3745.118176, -3745.118163, -3730.102862, -3730.102848, -3715.087535]","['10.128.0.5', '192.168.1.9', '10.128.0.5', '10.128.0.5', '192.168.1.9', '10.128.0.5', '192.168.1.9', '10.128.0.5', '192.168.1.9', '10.128.0.5', '192.168.1.9', '10.128.0.5', '192.168.1.9', '10.128.0.5', '192.168.1.9', '10.128.0.5', '192.168.1.9', '10.128.0.5', '192.168.1.9', '10.128.0.5', '192.168.1.9', '10.128.0.5', '192.168.1.9', '10.128.0.5', '192.168.1.9', '10.128.0.5', '192.168.1.9', '10.128.0.5', '192.168.1.9', '10.128.0.5']","['192.168.1.9', '10.128.0.5', '192.168.1.9', '192.168.1.9', '10.128.0.5', '192.168.1.9', '10.128.0.5', '192.168.1.9', '10.128.0.5', '192.168.1.9', '10.128.0.5', '192.168.1.9', '10.128.0.5', '192.168.1.9', '10.128.0.5', '192.168.1.9', '10.128.0.5', '192.168.1.9', '10.128.0.5', '192.168.1.9', '10.128.0.5', '192.168.1.9', '10.128.0.5', '192.168.1.9', '10.128.0.5', '192.168.1.9', '10.128.0.5', '192.168.1.9', '10.128.0.5', '192.168.1.9']","['TCP', 'TCP', 'TCP', 'TCP', 'TCP', 'TCP', 'TCP', 'TCP', 'TCP', 'TCP', 'TCP', 'TCP', 'TCP', 'TCP', 'TCP', 'TCP', 'TCP', 'TCP', 'TCP', 'TCP', 'TCP', 'TCP', 'TCP', 'TCP', 'TCP', 'TCP', 'TCP', 'TCP', 'TCP', 'TCP']","[74, 66, 54, 75, 54, 222, 54, 65, 54, 65, 54, 65, 54, 64, 54, 65, 54, 65, 54, 65, 54, 65, 54, 65, 54, 65, 54, 65, 54, 65]","['47616  >  80 [SYN] Seq=0 Win=29200 Len=0 MSS=1460 SACK_PERM TSval=1441947099 TSecr=0 WS=128', '80  >  47616 [SYN, ACK] Seq=0 Ack=1 Win=42340 Len=0 MSS=1460 SACK_PERM WS=8192', '47616  >  80 [ACK] Seq=1 Ack=1 Win=29312 Len=0', '47616  >  80 [PSH, ACK] Seq=1 Ack=1 Win=29312 Len=21 [TCP segment of a reassembled PDU]', '80  >  47616 [ACK] Seq=1 Ack=22 Win=49152 Len=0', '47616  >  80 [PSH, ACK] Seq=22 Ack=1 Win=29312 Len=168 [TCP segment of a reassembled PDU]', '80  >  47616 [ACK] Seq=1 Ack=190 Win=49152 Len=0', '47616  >  80 [PSH, ACK] Seq=190 Ack=1 Win=29312 Len=11 [TCP segment of a reassembled PDU]', '80  >  47616 [ACK] Seq=1 Ack=201 Win=49152 Len=0', '47616  >  80 [PSH, ACK] Seq=201 Ack=1 Win=29312 Len=11 [TCP segment of a reassembled PDU]', '80  >  47616 [ACK] Seq=1 Ack=212 Win=49152 Len=0', '47616  >  80 [PSH, ACK] Seq=212 Ack=1 Win=29312 Len=11 [TCP segment of a reassembled PDU]', '80  >  47616 [ACK] Seq=1 Ack=223 Win=49152 Len=0', '47616  >  80 [PSH, ACK] Seq=223 Ack=1 Win=29312 Len=10 [TCP segment of a reassembled PDU]', '80  >  47616 [ACK] Seq=1 Ack=233 Win=49152 Len=0', '47616  >  80 [PSH, ACK] Seq=233 Ack=1 Win=29312 Len=11 [TCP segment of a reassembled PDU]', '80  >  47616 [ACK] Seq=1 Ack=244 Win=49152 Len=0', '47616  >  80 [PSH, ACK] Seq=244 Ack=1 Win=29312 Len=11 [TCP segment of a reassembled PDU]', '80  >  47616 [ACK] Seq=1 Ack=255 Win=49152 Len=0', '47616  >  80 [PSH, ACK] Seq=255 Ack=1 Win=29312 Len=11 [TCP segment of a reassembled PDU]', '80  >  47616 [ACK] Seq=1 Ack=266 Win=49152 Len=0', '47616  >  80 [PSH, ACK] Seq=266 Ack=1 Win=29312 Len=11 [TCP segment of a reassembled PDU]', '80  >  47616 [ACK] Seq=1 Ack=277 Win=49152 Len=0', '47616  >  80 [PSH, ACK] Seq=277 Ack=1 Win=29312 Len=11 [TCP segment of a reassembled PDU]', '80  >  47616 [ACK] Seq=1 Ack=288 Win=49152 Len=0', '47616  >  80 [PSH, ACK] Seq=288 Ack=1 Win=29312 Len=11 [TCP segment of a reassembled PDU]', '80  >  47616 [ACK] Seq=1 Ack=299 Win=49152 Len=0', '47616  >  80 [PSH, ACK] Seq=299 Ack=1 Win=29312 Len=11 [TCP segment of a reassembled PDU]', '80  >  47616 [ACK] Seq=1 Ack=310 Win=49152 Len=0', '47616  >  80 [PSH, ACK] Seq=310 Ack=1 Win=29312 Len=11 [TCP segment of a reassembled PDU]']",1
"[413.855404, 414.853935, 414.853949, 414.854023, 414.854099, 414.854111, 414.854171, 414.854177, 414.854551, 414.854555, 429.87002, 429.870034, 444.885375, 444.88539, 459.900709, 459.900722, 474.91605, 474.916066, -3804.035908, -3804.035895, -3789.020577, -3789.020563, -3774.005248, -3774.005234, -3758.989903, -3758.989887, -3743.974567, -3743.974553, -3728.959235, -3728.95922]","['10.128.0.6', '10.128.0.6', '192.168.1.9', '10.128.0.6', '10.128.0.6', '192.168.1.9', '10.128.0.6', '192.168.1.9', '10.128.0.6', '192.168.1.9', '10.128.0.6', '192.168.1.9', '10.128.0.6', '192.168.1.9', '10.128.0.6', '192.168.1.9', '10.128.0.6', '192.168.1.9', '10.128.0.6', '192.168.1.9', '10.128.0.6', '192.168.1.9', '10.128.0.6', '192.168.1.9', '10.128.0.6', '192.168.1.9', '10.128.0.6', '192.168.1.9', '10.128.0.6', '192.168.1.9']","['192.168.1.9', '192.168.1.9', '10.128.0.6', '192.168.1.9', '192.168.1.9', '10.128.0.6', '192.168.1.9', '10.128.0.6', '192.168.1.9', '10.128.0.6', '192.168.1.9', '10.128.0.6', '192.168.1.9', '10.128.0.6', '192.168.1.9', '10.128.0.6', '192.168.1.9', '10.128.0.6', '192.168.1.9', '10.128.0.6', '192.168.1.9', '10.128.0.6', '192.168.1.9', '10.128.0.6', '192.168.1.9', '10.128.0.6', '192.168.1.9', '10.128.0.6', '192.168.1.9', '10.128.0.6']","['TCP', 'TCP', 'TCP', 'TCP', 'TCP', 'TCP', 'TCP', 'TCP', 'TCP', 'TCP', 'TCP', 'TCP', 'TCP', 'TCP', 'TCP', 'TCP', 'TCP', 'TCP', 'TCP', 'TCP', 'TCP', 'TCP', 'TCP', 'TCP', 'TCP', 'TCP', 'TCP', 'TCP', 'TCP', 'TCP']","[74, 74, 66, 54, 75, 54, 222, 54, 65, 54, 65, 54, 64, 54, 65, 54, 65, 54, 65, 54, 65, 54, 65, 54, 65, 54, 65, 54, 64, 54]","['43773  >  80 [SYN] Seq=0 Win=29200 Len=0 MSS=1460 SACK_PERM TSval=1441947136 TSecr=0 WS=128', '[TCP Retransmission] [TCP Port numbers reused] 43773  >  80 [SYN] Seq=0 Win=29200 Len=0 MSS=1460 SACK_PERM TSval=1441947386 TSecr=0 WS=128', '80  >  43773 [SYN, ACK] Seq=0 Ack=1 Win=42340 Len=0 MSS=1460 SACK_PERM WS=8192', '43773  >  80 [ACK] Seq=1 Ack=1 Win=29312 Len=0', '43773  >  80 [PSH, ACK] Seq=1 Ack=1 Win=29312 Len=21 [TCP segment of a reassembled PDU]', '80  >  43773 [ACK] Seq=1 Ack=22 Win=49152 Len=0', '43773  >  80 [PSH, ACK] Seq=22 Ack=1 Win=29312 Len=168 [TCP segment of a reassembled PDU]', '80  >  43773 [ACK] Seq=1 Ack=190 Win=49152 Len=0', '43773  >  80 [PSH, ACK] Seq=190 Ack=1 Win=29312 Len=11 [TCP segment of a reassembled PDU]', '80  >  43773 [ACK] Seq=1 Ack=201 Win=49152 Len=0', '43773  >  80 [PSH, ACK] Seq=201 Ack=1 Win=29312 Len=11 [TCP segment of a reassembled PDU]', '80  >  43773 [ACK] Seq=1 Ack=212 Win=49152 Len=0', '43773  >  80 [PSH, ACK] Seq=212 Ack=1 Win=29312 Len=10 [TCP segment of a reassembled PDU]', '80  >  43773 [ACK] Seq=1 Ack=222 Win=49152 Len=0', '43773  >  80 [PSH, ACK] Seq=222 Ack=1 Win=29312 Len=11 [TCP segment of a reassembled PDU]', '80  >  43773 [ACK] Seq=1 Ack=233 Win=49152 Len=0', '43773  >  80 [PSH, ACK] Seq=233 Ack=1 Win=29312 Len=11 [TCP segment of a reassembled PDU]', '80  >  43773 [ACK] Seq=1 Ack=244 Win=49152 Len=0', '43773  >  80 [PSH, ACK] Seq=244 Ack=1 Win=29312 Len=11 [TCP segment of a reassembled PDU]', '80  >  43773 [ACK] Seq=1 Ack=255 Win=49152 Len=0', '43773  >  80 [PSH, ACK] Seq=255 Ack=1 Win=29312 Len=11 [TCP segment of a reassembled PDU]', '80  >  43773 [ACK] Seq=1 Ack=266 Win=49152 Len=0', '43773  >  80 [PSH, ACK] Seq=266 Ack=1 Win=29312 Len=11 [TCP segment of a reassembled PDU]', '80  >  43773 [ACK] Seq=1 Ack=277 Win=49152 Len=0', '43773  >  80 [PSH, ACK] Seq=277 Ack=1 Win=29312 Len=11 [TCP segment of a reassembled PDU]', '80  >  43773 [ACK] Seq=1 Ack=288 Win=49152 Len=0', '43773  >  80 [PSH, ACK] Seq=288 Ack=1 Win=29312 Len=11 [TCP segment of a reassembled PDU]', '80  >  43773 [ACK] Seq=1 Ack=299 Win=49152 Len=0', '43773  >  80 [PSH, ACK] Seq=299 Ack=1 Win=29312 Len=10 [TCP segment of a reassembled PDU]', '80  >  43773 [ACK] Seq=1 Ack=309 Win=49152 Len=0']",1
"[413.924719, 414.921935, 416.925933, 417.926655, 417.926657, 417.9267, 417.927189, 417.927192, 417.927238, 417.92724, 432.942611, 432.942624, 447.957915, 447.95793, 462.973266, 462.973279, 477.988593, 477.988607, -3800.96337, -3800.963358, -3785.948042, -3785.948032, -3770.932704, -3770.932691, -3755.917373, -3755.917359, -3740.902044, -3740.902031, -3725.886714, -3725.8867]","['10.128.0.7', '10.128.0.7', '10.128.0.7', '10.128.0.7', '192.168.1.9', '10.128.0.7', '10.128.0.7', '192.168.1.9', '10.128.0.7', '192.168.1.9', '10.128.0.7', '192.168.1.9', '10.128.0.7', '192.168.1.9', '10.128.0.7', '192.168.1.9', '10.128.0.7', '192.168.1.9', '10.128.0.7', '192.168.1.9', '10.128.0.7', '192.168.1.9', '10.128.0.7', '192.168.1.9', '10.128.0.7', '192.168.1.9', '10.128.0.7', '192.168.1.9', '10.128.0.7', '192.168.1.9']","['192.168.1.9', '192.168.1.9', '192.168.1.9', '192.168.1.9', '10.128.0.7', '192.168.1.9', '192.168.1.9', '10.128.0.7', '192.168.1.9', '10.128.0.7', '192.168.1.9', '10.128.0.7', '192.168.1.9', '10.128.0.7', '192.168.1.9', '10.128.0.7', '192.168.1.9', '10.128.0.7', '192.168.1.9', '10.128.0.7', '192.168.1.9', '10.128.0.7', '192.168.1.9', '10.128.0.7', '192.168.1.9', '10.128.0.7', '192.168.1.9', '10.128.0.7', '192.168.1.9', '10.128.0.7']","['TCP', 'TCP', 'TCP', 'TCP', 'TCP', 'TCP', 'TCP', 'TCP', 'TCP', 'TCP', 'TCP', 'TCP', 'TCP', 'TCP', 'TCP', 'TCP', 'TCP', 'TCP', 'TCP', 'TCP', 'TCP', 'TCP', 'TCP', 'TCP', 'TCP', 'TCP', 'TCP', 'TCP', 'TCP', 'TCP']","[74, 74, 74, 74, 66, 54, 74, 54, 222, 54, 65, 54, 65, 54, 64, 54, 65, 54, 65, 54, 64, 54, 65, 54, 65, 54, 65, 54, 65, 54]","['42736  >  80 [SYN] Seq=0 Win=29200 Len=0 MSS=1460 SACK_PERM TSval=1441947153 TSecr=0 WS=128', '[TCP Retransmission] [TCP Port numbers reused] 42736  >  80 [SYN] Seq=0 Win=29200 Len=0 MSS=1460 SACK_PERM TSval=1441947403 TSecr=0 WS=128', '[TCP Retransmission] [TCP Port numbers reused] 42736  >  80 [SYN] Seq=0 Win=29200 Len=0 MSS=1460 SACK_PERM TSval=1441947904 TSecr=0 WS=128', '35936  >  80 [SYN] Seq=0 Win=29200 Len=0 MSS=1460 SACK_PERM TSval=1441948154 TSecr=0 WS=128', '80  >  35936 [SYN, ACK] Seq=0 Ack=1 Win=42340 Len=0 MSS=1460 SACK_PERM WS=8192', '35936  >  80 [ACK] Seq=1 Ack=1 Win=29312 Len=0', '35936  >  80 [PSH, ACK] Seq=1 Ack=1 Win=29312 Len=20 [TCP segment of a reassembled PDU]', '80  >  35936 [ACK] Seq=1 Ack=21 Win=49152 Len=0', '35936  >  80 [PSH, ACK] Seq=21 Ack=1 Win=29312 Len=168 [TCP segment of a reassembled PDU]', '80  >  35936 [ACK] Seq=1 Ack=189 Win=49152 Len=0', '35936  >  80 [PSH, ACK] Seq=189 Ack=1 Win=29312 Len=11 [TCP segment of a reassembled PDU]', '80  >  35936 [ACK] Seq=1 Ack=200 Win=49152 Len=0', '35936  >  80 [PSH, ACK] Seq=200 Ack=1 Win=29312 Len=11 [TCP segment of a reassembled PDU]', '80  >  35936 [ACK] Seq=1 Ack=211 Win=49152 Len=0', '35936  >  80 [PSH, ACK] Seq=211 Ack=1 Win=29312 Len=10 [TCP segment of a reassembled PDU]', '80  >  35936 [ACK] Seq=1 Ack=221 Win=49152 Len=0', '35936  >  80 [PSH, ACK] Seq=221 Ack=1 Win=29312 Len=11 [TCP segment of a reassembled PDU]', '80  >  35936 [ACK] Seq=1 Ack=232 Win=49152 Len=0', '35936  >  80 [PSH, ACK] Seq=232 Ack=1 Win=29312 Len=11 [TCP segment of a reassembled PDU]', '80  >  35936 [ACK] Seq=1 Ack=243 Win=49152 Len=0', '35936  >  80 [PSH, ACK] Seq=243 Ack=1 Win=29312 Len=10 [TCP segment of a reassembled PDU]', '80  >  35936 [ACK] Seq=1 Ack=253 Win=49152 Len=0', '35936  >  80 [PSH, ACK] Seq=253 Ack=1 Win=29312 Len=11 [TCP segment of a reassembled PDU]', '80  >  35936 [ACK] Seq=1 Ack=264 Win=49152 Len=0', '35936  >  80 [PSH, ACK] Seq=264 Ack=1 Win=29312 Len=11 [TCP segment of a reassembled PDU]', '80  >  35936 [ACK] Seq=1 Ack=275 Win=49152 Len=0', '35936  >  80 [PSH, ACK] Seq=275 Ack=1 Win=29312 Len=11 [TCP segment of a reassembled PDU]', '80  >  35936 [ACK] Seq=1 Ack=286 Win=49152 Len=0', '35936  >  80 [PSH, ACK] Seq=286 Ack=1 Win=29312 Len=11 [TCP segment of a reassembled PDU]', '80  >  35936 [ACK] Seq=1 Ack=297 Win=49152 Len=0']",1
"[413.95142, 414.949973, 416.953926, 417.954324, 418.953927, 418.953934, 418.953977, 418.954018, 418.954024, 418.954061, 418.954063, 433.969415, 433.969428, 448.984757, 448.984773, 464.000088, 464.000103, 479.015417, 479.015434, -3799.936536, -3799.936521, -3784.921183, -3784.921166, -3769.905857, -3769.905841, -3754.890515, -3754.890498, -3739.875189, -3739.875172, -3724.859857]","['10.128.0.8', '10.128.0.8', '10.128.0.8', '10.128.0.8', '10.128.0.8', '192.168.1.9', '10.128.0.8', '10.128.0.8', '192.168.1.9', '10.128.0.8', '192.168.1.9', '10.128.0.8', '192.168.1.9', '10.128.0.8', '192.168.1.9', '10.128.0.8', '192.168.1.9', '10.128.0.8', '192.168.1.9', '10.128.0.8', '192.168.1.9', '10.128.0.8', '192.168.1.9', '10.128.0.8', '192.168.1.9', '10.128.0.8', '192.168.1.9', '10.128.0.8', '192.168.1.9', '10.128.0.8']","['192.168.1.9', '192.168.1.9', '192.168.1.9', '192.168.1.9', '192.168.1.9', '10.128.0.8', '192.168.1.9', '192.168.1.9', '10.128.0.8', '192.168.1.9', '10.128.0.8', '192.168.1.9', '10.128.0.8', '192.168.1.9', '10.128.0.8', '192.168.1.9', '10.128.0.8', '192.168.1.9', '10.128.0.8', '192.168.1.9', '10.128.0.8', '192.168.1.9', '10.128.0.8', '192.168.1.9', '10.128.0.8', '192.168.1.9', '10.128.0.8', '192.168.1.9', '10.128.0.8', '192.168.1.9']","['TCP', 'TCP', 'TCP', 'TCP', 'TCP', 'TCP', 'TCP', 'TCP', 'TCP', 'TCP', 'TCP', 'TCP', 'TCP', 'TCP', 'TCP', 'TCP', 'TCP', 'TCP', 'TCP', 'TCP', 'TCP', 'TCP', 'TCP', 'TCP', 'TCP', 'TCP', 'TCP', 'TCP', 'TCP', 'TCP']","[74, 74, 74, 74, 74, 66, 54, 75, 54, 222, 54, 65, 54, 65, 54, 65, 54, 65, 54, 65, 54, 65, 54, 65, 54, 65, 54, 65, 54, 65]","['34216  >  80 [SYN] Seq=0 Win=29200 Len=0 MSS=1460 SACK_PERM TSval=1441947160 TSecr=0 WS=128', '[TCP Retransmission] [TCP Port numbers reused] 34216  >  80 [SYN] Seq=0 Win=29200 Len=0 MSS=1460 SACK_PERM TSval=1441947410 TSecr=0 WS=128', '[TCP Retransmission] [TCP Port numbers reused] 34216  >  80 [SYN] Seq=0 Win=29200 Len=0 MSS=1460 SACK_PERM TSval=1441947911 TSecr=0 WS=128', '55059  >  80 [SYN] Seq=0 Win=29200 Len=0 MSS=1460 SACK_PERM TSval=1441948161 TSecr=0 WS=128', '[TCP Retransmission] [TCP Port numbers reused] 55059  >  80 [SYN] Seq=0 Win=29200 Len=0 MSS=1460 SACK_PERM TSval=1441948411 TSecr=0 WS=128', '80  >  55059 [SYN, ACK] Seq=0 Ack=1 Win=42340 Len=0 MSS=1460 SACK_PERM WS=8192', '55059  >  80 [ACK] Seq=1 Ack=1 Win=29312 Len=0', '55059  >  80 [PSH, ACK] Seq=1 Ack=1 Win=29312 Len=21 [TCP segment of a reassembled PDU]', '80  >  55059 [ACK] Seq=1 Ack=22 Win=49152 Len=0', '55059  >  80 [PSH, ACK] Seq=22 Ack=1 Win=29312 Len=168 [TCP segment of a reassembled PDU]', '80  >  55059 [ACK] Seq=1 Ack=190 Win=49152 Len=0', '55059  >  80 [PSH, ACK] Seq=190 Ack=1 Win=29312 Len=11 [TCP segment of a reassembled PDU]', '80  >  55059 [ACK] Seq=1 Ack=201 Win=49152 Len=0', '55059  >  80 [PSH, ACK] Seq=201 Ack=1 Win=29312 Len=11 [TCP segment of a reassembled PDU]', '80  >  55059 [ACK] Seq=1 Ack=212 Win=49152 Len=0', '55059  >  80 [PSH, ACK] Seq=212 Ack=1 Win=29312 Len=11 [TCP segment of a reassembled PDU]', '80  >  55059 [ACK] Seq=1 Ack=223 Win=49152 Len=0', '55059  >  80 [PSH, ACK] Seq=223 Ack=1 Win=29312 Len=11 [TCP segment of a reassembled PDU]', '80  >  55059 [ACK] Seq=1 Ack=234 Win=49152 Len=0', '55059  >  80 [PSH, ACK] Seq=234 Ack=1 Win=29312 Len=11 [TCP segment of a reassembled PDU]', '80  >  55059 [ACK] Seq=1 Ack=245 Win=49152 Len=0', '55059  >  80 [PSH, ACK] Seq=245 Ack=1 Win=29312 Len=11 [TCP segment of a reassembled PDU]', '80  >  55059 [ACK] Seq=1 Ack=256 Win=49152 Len=0', '55059  >  80 [PSH, ACK] Seq=256 Ack=1 Win=29312 Len=11 [TCP segment of a reassembled PDU]', '80  >  55059 [ACK] Seq=1 Ack=267 Win=49152 Len=0', '55059  >  80 [PSH, ACK] Seq=267 Ack=1 Win=29312 Len=11 [TCP segment of a reassembled PDU]', '80  >  55059 [ACK] Seq=1 Ack=278 Win=49152 Len=0', '55059  >  80 [PSH, ACK] Seq=278 Ack=1 Win=29312 Len=11 [TCP segment of a reassembled PDU]', '80  >  55059 [ACK] Seq=1 Ack=289 Win=49152 Len=0', '55059  >  80 [PSH, ACK] Seq=289 Ack=1 Win=29312 Len=11 [TCP segment of a reassembled PDU]']",1
"[464.000088, 464.000103, 479.015417, 479.015434, -3799.936536, -3799.936521, -3784.921183, -3784.921166, -3769.905857, -3769.905841, -3754.890515, -3754.890498, -3739.875189, -3739.875172, -3724.859857, -3724.85984, -3709.844522, -3709.844505, -3694.829183, -3694.829166, -3679.813847, -3679.813832, -3664.798513, -3664.798496, -3649.783177, -3649.783161, -3640.308611, -3640.271752, -3640.231726, -3640.231722]","['10.128.0.8', '192.168.1.9', '10.128.0.8', '192.168.1.9', '10.128.0.8', '192.168.1.9', '10.128.0.8', '192.168.1.9', '10.128.0.8', '192.168.1.9', '10.128.0.8', '192.168.1.9', '10.128.0.8', '192.168.1.9', '10.128.0.8', '192.168.1.9', '10.128.0.8', '192.168.1.9', '10.128.0.8', '192.168.1.9', '10.128.0.8', '192.168.1.9', '10.128.0.8', '192.168.1.9', '10.128.0.8', '192.168.1.9', '10.128.0.8', '192.168.1.9', '192.168.1.9', '192.168.1.9']","['192.168.1.9', '10.128.0.8', '192.168.1.9', '10.128.0.8', '192.168.1.9', '10.128.0.8', '192.168.1.9', '10.128.0.8', '192.168.1.9', '10.128.0.8', '192.168.1.9', '10.128.0.8', '192.168.1.9', '10.128.0.8', '192.168.1.9', '10.128.0.8', '192.168.1.9', '10.128.0.8', '192.168.1.9', '10.128.0.8', '192.168.1.9', '10.128.0.8', '192.168.1.9', '10.128.0.8', '192.168.1.9', '10.128.0.8', '192.168.1.9', '10.128.0.8', '10.128.0.8', '10.128.0.8']","['TCP', 'TCP', 'TCP', 'TCP', 'TCP', 'TCP', 'TCP', 'TCP', 'TCP', 'TCP', 'TCP', 'TCP', 'TCP', 'TCP', 'TCP', 'TCP', 'TCP', 'TCP', 'TCP', 'TCP', 'TCP', 'TCP', 'TCP', 'TCP', 'TCP', 'TCP', 'TCP', 'TCP', 'HTTP', 'TCP']","[65, 54, 65, 54, 65, 54, 65, 54, 65, 54, 65, 54, 65, 54, 65, 54, 65, 54, 65, 54, 65, 54, 64, 54, 64, 54, 60, 54, 537, 54]","['55059  >  80 [PSH, ACK] Seq=212 Ack=1 Win=29312 Len=11 [TCP segment of a reassembled PDU]', '80  >  55059 [ACK] Seq=1 Ack=223 Win=49152 Len=0', '55059  >  80 [PSH, ACK] Seq=223 Ack=1 Win=29312 Len=11 [TCP segment of a reassembled PDU]', '80  >  55059 [ACK] Seq=1 Ack=234 Win=49152 Len=0', '55059  >  80 [PSH, ACK] Seq=234 Ack=1 Win=29312 Len=11 [TCP segment of a reassembled PDU]', '80  >  55059 [ACK] Seq=1 Ack=245 Win=49152 Len=0', '55059  >  80 [PSH, ACK] Seq=245 Ack=1 Win=29312 Len=11 [TCP segment of a reassembled PDU]', '80  >  55059 [ACK] Seq=1 Ack=256 Win=49152 Len=0', '55059  >  80 [PSH, ACK] Seq=256 Ack=1 Win=29312 Len=11 [TCP segment of a reassembled PDU]', '80  >  55059 [ACK] Seq=1 Ack=267 Win=49152 Len=0', '55059  >  80 [PSH, ACK] Seq=267 Ack=1 Win=29312 Len=11 [TCP segment of a reassembled PDU]', '80  >  55059 [ACK] Seq=1 Ack=278 Win=49152 Len=0', '55059  >  80 [PSH, ACK] Seq=278 Ack=1 Win=29312 Len=11 [TCP segment of a reassembled PDU]', '80  >  55059 [ACK] Seq=1 Ack=289 Win=49152 Len=0', '55059  >  80 [PSH, ACK] Seq=289 Ack=1 Win=29312 Len=11 [TCP segment of a reassembled PDU]', '80  >  55059 [ACK] Seq=1 Ack=300 Win=49152 Len=0', '55059  >  80 [PSH, ACK] Seq=300 Ack=1 Win=29312 Len=11 [TCP segment of a reassembled PDU]', '80  >  55059 [ACK] Seq=1 Ack=311 Win=49152 Len=0', '55059  >  80 [PSH, ACK] Seq=311 Ack=1 Win=29312 Len=11 [TCP segment of a reassembled PDU]', '80  >  55059 [ACK] Seq=1 Ack=322 Win=49152 Len=0', '55059  >  80 [PSH, ACK] Seq=322 Ack=1 Win=29312 Len=11 [TCP segment of a reassembled PDU]', '80  >  55059 [ACK] Seq=1 Ack=333 Win=49152 Len=0', '55059  >  80 [PSH, ACK] Seq=333 Ack=1 Win=29312 Len=10 [TCP segment of a reassembled PDU]', '80  >  55059 [ACK] Seq=1 Ack=343 Win=49152 Len=0', 'GET /?1220 HTTP/1.1  [TCP segment of a reassembled PDU]', '80  >  55059 [ACK] Seq=1 Ack=353 Win=49152 Len=0', '55059  >  80 [FIN, ACK] Seq=353 Ack=1 Win=29312 Len=0', '80  >  55059 [ACK] Seq=1 Ack=354 Win=49152 Len=0', 'HTTP/1.1 400 Bad Request  (text/html)', '80  >  55059 [FIN, ACK] Seq=484 Ack=354 Win=49152 Len=0']",1
"[413.936964, 414.933951, 416.937938, 417.938383, 417.938385, 417.93843, 417.938484, 417.938487, 417.938531, 417.938533, 432.953955, 432.953969, 447.969286, 447.969301, 462.984666, 462.984682, 478.000019, 478.000034, -3800.951928, -3800.951914, -3785.936589, -3785.936577, -3770.92124, -3770.921226, -3755.90592, -3755.905903, -3740.890579, -3740.890567, -3725.875231, -3725.875216]","['10.128.0.9', '10.128.0.9', '10.128.0.9', '10.128.0.9', '192.168.1.9', '10.128.0.9', '10.128.0.9', '192.168.1.9', '10.128.0.9', '192.168.1.9', '10.128.0.9', '192.168.1.9', '10.128.0.9', '192.168.1.9', '10.128.0.9', '192.168.1.9', '10.128.0.9', '192.168.1.9', '10.128.0.9', '192.168.1.9', '10.128.0.9', '192.168.1.9', '10.128.0.9', '192.168.1.9', '10.128.0.9', '192.168.1.9', '10.128.0.9', '192.168.1.9', '10.128.0.9', '192.168.1.9']","['192.168.1.9', '192.168.1.9', '192.168.1.9', '192.168.1.9', '10.128.0.9', '192.168.1.9', '192.168.1.9', '10.128.0.9', '192.168.1.9', '10.128.0.9', '192.168.1.9', '10.128.0.9', '192.168.1.9', '10.128.0.9', '192.168.1.9', '10.128.0.9', '192.168.1.9', '10.128.0.9', '192.168.1.9', '10.128.0.9', '192.168.1.9', '10.128.0.9', '192.168.1.9', '10.128.0.9', '192.168.1.9', '10.128.0.9', '192.168.1.9', '10.128.0.9', '192.168.1.9', '10.128.0.9']","['TCP', 'TCP', 'TCP', 'TCP', 'TCP', 'TCP', 'TCP', 'TCP', 'TCP', 'TCP', 'TCP', 'TCP', 'TCP', 'TCP', 'TCP', 'TCP', 'TCP', 'TCP', 'TCP', 'TCP', 'TCP', 'TCP', 'TCP', 'TCP', 'TCP', 'TCP', 'TCP', 'TCP', 'TCP', 'TCP']","[74, 74, 74, 74, 66, 54, 75, 54, 222, 54, 65, 54, 64, 54, 64, 54, 65, 54, 64, 54, 65, 54, 65, 54, 64, 54, 65, 54, 65, 54]","['40271  >  80 [SYN] Seq=0 Win=29200 Len=0 MSS=1460 SACK_PERM TSval=1441947156 TSecr=0 WS=128', '[TCP Retransmission] [TCP Port numbers reused] 40271  >  80 [SYN] Seq=0 Win=29200 Len=0 MSS=1460 SACK_PERM TSval=1441947406 TSecr=0 WS=128', '[TCP Retransmission] [TCP Port numbers reused] 40271  >  80 [SYN] Seq=0 Win=29200 Len=0 MSS=1460 SACK_PERM TSval=1441947907 TSecr=0 WS=128', '58191  >  80 [SYN] Seq=0 Win=29200 Len=0 MSS=1460 SACK_PERM TSval=1441948157 TSecr=0 WS=128', '80  >  58191 [SYN, ACK] Seq=0 Ack=1 Win=42340 Len=0 MSS=1460 SACK_PERM WS=8192', '58191  >  80 [ACK] Seq=1 Ack=1 Win=29312 Len=0', '58191  >  80 [PSH, ACK] Seq=1 Ack=1 Win=29312 Len=21 [TCP segment of a reassembled PDU]', '80  >  58191 [ACK] Seq=1 Ack=22 Win=49152 Len=0', '58191  >  80 [PSH, ACK] Seq=22 Ack=1 Win=29312 Len=168 [TCP segment of a reassembled PDU]', '80  >  58191 [ACK] Seq=1 Ack=190 Win=49152 Len=0', '58191  >  80 [PSH, ACK] Seq=190 Ack=1 Win=29312 Len=11 [TCP segment of a reassembled PDU]', '80  >  58191 [ACK] Seq=1 Ack=201 Win=49152 Len=0', '58191  >  80 [PSH, ACK] Seq=201 Ack=1 Win=29312 Len=10 [TCP segment of a reassembled PDU]', '80  >  58191 [ACK] Seq=1 Ack=211 Win=49152 Len=0', '58191  >  80 [PSH, ACK] Seq=211 Ack=1 Win=29312 Len=10 [TCP segment of a reassembled PDU]', '80  >  58191 [ACK] Seq=1 Ack=221 Win=49152 Len=0', '58191  >  80 [PSH, ACK] Seq=221 Ack=1 Win=29312 Len=11 [TCP segment of a reassembled PDU]', '80  >  58191 [ACK] Seq=1 Ack=232 Win=49152 Len=0', '58191  >  80 [PSH, ACK] Seq=232 Ack=1 Win=29312 Len=10 [TCP segment of a reassembled PDU]', '80  >  58191 [ACK] Seq=1 Ack=242 Win=49152 Len=0', '58191  >  80 [PSH, ACK] Seq=242 Ack=1 Win=29312 Len=11 [TCP segment of a reassembled PDU]', '80  >  58191 [ACK] Seq=1 Ack=253 Win=49152 Len=0', '58191  >  80 [PSH, ACK] Seq=253 Ack=1 Win=29312 Len=11 [TCP segment of a reassembled PDU]', '80  >  58191 [ACK] Seq=1 Ack=264 Win=49152 Len=0', '58191  >  80 [PSH, ACK] Seq=264 Ack=1 Win=29312 Len=10 [TCP segment of a reassembled PDU]', '80  >  58191 [ACK] Seq=1 Ack=274 Win=49152 Len=0', '58191  >  80 [PSH, ACK] Seq=274 Ack=1 Win=29312 Len=11 [TCP segment of a reassembled PDU]', '80  >  58191 [ACK] Seq=1 Ack=285 Win=49152 Len=0', '58191  >  80 [PSH, ACK] Seq=285 Ack=1 Win=29312 Len=11 [TCP segment of a reassembled PDU]', '80  >  58191 [ACK] Seq=1 Ack=296 Win=49152 Len=0']",1
